{
  "version": "0.1",
  "author": "Electronic Frontier Foundation https://eff.org",
  "expires": "2015-08-01T12:00:00+08:00",
  "timestamp": 1401414363,
  "policy-aliases": {},
  "pinsets": {},
  "policies": {
    "yahoodns.net": {
      "mode": "testing",
      "mxs": [".yahoodns.net"]
    },
    "eff.org": {
      "mode": "enforce",
      "mxs": [".eff.org"]
    },
    "google.com": {
      "mode": "testing",
      "mxs": [".google.com"],
      "report": ["https://google.com/post/reports/here"]
    }
  }
}
